{
  "schema_version": "1.0",
  "metadata": {
    "scan_id": "",
    "cluster_name": "golden-demo",
    "scan_mode": "offline",
    "lang": "en",
    "tatar_version": "",
    "scanner_versions": {
      "checkov": "3.2.10",
      "kubescape": "3.1.4",
      "popeye": "0.22.1",
      "trivy": "0.67.2"
    },
    "scanner_runs": [
      {
        "scanner": "trivy",
        "status": "ingested",
        "version": "0.67.2",
        "raw_bytes": 2954,
        "findings": 5
      },
      {
        "scanner": "kubescape",
        "status": "ingested",
        "version": "3.1.4",
        "raw_bytes": 1027,
        "findings": 3
      },
      {
        "scanner": "checkov",
        "status": "ingested",
        "version": "3.2.10",
        "raw_bytes": 41403,
        "findings": 89,
        "unmapped_rules": [
          "CKV2_K8S_1",
          "CKV2_K8S_2",
          "CKV2_K8S_3",
          "CKV2_K8S_4",
          "CKV2_K8S_5",
          "CKV_K8S_30",
          "CKV_K8S_40",
          "CKV_K8S_42",
          "CKV_K8S_43"
        ],
        "unmapped_count": 19
      },
      {
        "scanner": "popeye",
        "status": "ingested",
        "version": "0.22.1",
        "raw_bytes": 1603,
        "findings": 6
      }
    ],
    "rollup": {
      "moved": 3,
      "pods": [
        "latest-app-598c4dc6b8-ldjqq"
      ]
    },
    "started_at": "",
    "finished_at": "",
    "result_hash": "sha256:c887c5d96de4e6df3f92691840c967e212515219213f4f225e50f6862c597b6a",
    "inventory": {
      "ClusterRoles": 27,
      "Deployments": 31,
      "Ingresses": 6,
      "Namespaces": 8,
      "Nodes": 5,
      "Pods": 142,
      "Services": 54
    }
  },
  "summary": {
    "counts": {
      "CRITICAL": 2,
      "HIGH": 18,
      "INFO": 2,
      "LOW": 19,
      "MEDIUM": 34
    },
    "blind_shot": 0,
    "risk_score": 19,
    "risk_band": "Critical",
    "total_findings": 75,
    "risk_breakdown": {
      "total_penalty": 427.4,
      "high_penalty": 417.4,
      "low_penalty_raw": 34.2,
      "low_penalty_capped": 10,
      "low_pool_cap": 10,
      "scale": 100,
      "formula": "100 / (1 + P/K)",
      "top_contributors": [
        {
          "id": "TK-9b701eb0482a",
          "canonical_control": "TATAR-IMG-001",
          "resource": "deployment/api",
          "severity": "CRITICAL",
          "contribution": 18,
          "share": 4
        },
        {
          "id": "TK-099acce09622",
          "canonical_control": "TATAR-CON-003",
          "resource": "deployment/root-app",
          "severity": "HIGH",
          "contribution": 12.6,
          "share": 2.8
        },
        {
          "id": "TK-136338cfcb62",
          "canonical_control": "TATAR-CON-004",
          "resource": "deployment/root-app",
          "severity": "HIGH",
          "contribution": 12.6,
          "share": 2.8
        },
        {
          "id": "TK-31cdabe90e87",
          "canonical_control": "TATAR-CON-001",
          "resource": "deployment/privileged-app",
          "severity": "HIGH",
          "contribution": 12.6,
          "share": 2.8
        },
        {
          "id": "TK-3d236fda3600",
          "canonical_control": "TATAR-CON-006",
          "resource": "deployment/host-ns-app",
          "severity": "HIGH",
          "contribution": 12.6,
          "share": 2.8
        }
      ]
    }
  },
  "findings": [
    {
      "id": "TK-9b701eb0482a",
      "canonical_control": "TATAR-IMG-001",
      "resource": "deployment/api",
      "namespace": "production",
      "type": "vulnerability",
      "category": "Image Security",
      "severity": "CRITICAL",
      "original_severity": "CRITICAL",
      "title": "Critical CVE in container image",
      "description": "openssl critical flaw",
      "evidence": [
        {
          "scanner": "trivy",
          "value": "fixed in 3.1.4",
          "detail": "openssl@3.1.0"
        }
      ],
      "remediation": "Update the base image/package or apply a patch.",
      "found_by": [
        "trivy"
      ],
      "confidence": "HIGH",
      "confidence_reason": "single-scanner",
      "blind_shot": false,
      "risk_contribution": 18,
      "risk_factors": {
        "base_weight": 10,
        "asset_context": 1.5,
        "exposure": 1,
        "confidence": 1.2,
        "contribution": 18
      },
      "status": "OPEN",
      "first_seen": "",
      "last_seen": "",
      "references": [
        "CVE-2024-0001",
        "https://avd.aquasec.com/nvd/cve-2024-0001"
      ],
      "raw_refs": [
        {
          "scanner": "trivy",
          "rule_id": "CVE-*"
        }
      ]
    },
    {
      "id": "TK-951f02615a28",
      "canonical_control": "TATAR-RBAC-001",
      "resource": "clusterrolebinding/admin-bind",
      "type": "rbac",
      "category": "RBAC \u0026 Authorization",
      "severity": "CRITICAL",
      "original_severity": "CRITICAL",
      "title": "cluster-admin binding overuse",
      "description": "A subject is bound directly to cluster-admin.",
      "remediation": "Restrict cluster-admin; use specific scoped roles.",
      "found_by": [
        "kubescape"
      ],
      "confidence": "HIGH",
      "confidence_reason": "single-scanner",
      "blind_shot": false,
      "risk_contribution": 12,
      "risk_factors": {
        "base_weight": 10,
        "asset_context": 1,
        "exposure": 1,
        "confidence": 1.2,
        "contribution": 12
      },
      "attack": [
        {
          "technique": "T1078",
          "name": "Valid Accounts",
          "tactic": "Privilege Escalation"
        }
      ],
      "status": "OPEN",
      "first_seen": "",
      "last_seen": "",
      "raw_refs": [
        {
          "scanner": "kubescape",
          "rule_id": "C-0035"
        }
      ]
    },
    {
      "id": "TK-099acce09622",
      "canonical_control": "TATAR-CON-003",
      "resource": "deployment/root-app",
      "namespace": "production",
      "type": "misconfiguration",
      "category": "Container Security",
      "severity": "HIGH",
      "original_severity": "HIGH",
      "title": "Allow privilege escalation",
      "description": "allowPrivilegeEscalation=true lets a process gain more privileges than the one that started it.",
      "evidence": [
        {
          "scanner": "checkov",
          "path": "/lab/broken/root-user.yaml:2-20"
        }
      ],
      "remediation": "Set securityContext.allowPrivilegeEscalation=false.",
      "found_by": [
        "checkov"
      ],
      "confidence": "HIGH",
      "confidence_reason": "single-scanner",
      "blind_shot": false,
      "risk_contribution": 12.6,
      "risk_factors": {
        "base_weight": 7,
        "asset_context": 1.5,
        "exposure": 1,
        "confidence": 1.2,
        "contribution": 12.6
      },
      "attack": [
        {
          "technique": "T1611",
          "name": "Escape to Host",
          "tactic": "Privilege Escalation"
        }
      ],
      "status": "OPEN",
      "first_seen": "",
      "last_seen": "",
      "raw_refs": [
        {
          "scanner": "checkov",
          "rule_id": "CKV_K8S_20"
        }
      ]
    },
    {
      "id": "TK-136338cfcb62",
      "canonical_control": "TATAR-CON-004",
      "resource": "deployment/root-app",
      "namespace": "production",
      "type": "misconfiguration",
      "category": "Container Security",
      "severity": "HIGH",
      "original_severity": "HIGH",
      "title": "Dangerous capabilities added",
      "description": "Dangerous Linux capabilities such as SYS_ADMIN or NET_ADMIN are added to the container.",
      "evidence": [
        {
          "scanner": "checkov",
          "path": "/lab/broken/root-user.yaml:2-20"
        }
      ],
      "remediation": "Drop unnecessary capabilities; start by dropping ALL.",
      "found_by": [
        "checkov"
      ],
      "confidence": "HIGH",
      "confidence_reason": "single-scanner",
      "blind_shot": false,
      "risk_contribution": 12.6,
      "risk_factors": {
        "base_weight": 7,
        "asset_context": 1.5,
        "exposure": 1,
        "confidence": 1.2,
        "contribution": 12.6
      },
      "status": "OPEN",
      "first_seen": "",
      "last_seen": "",
      "raw_refs": [
        {
          "scanner": "checkov",
          "rule_id": "CKV_K8S_28"
        },
        {
          "scanner": "checkov",
          "rule_id": "CKV_K8S_37"
        }
      ]
    },
    {
      "id": "TK-31cdabe90e87",
      "canonical_control": "TATAR-CON-001",
      "resource": "deployment/privileged-app",
      "namespace": "production",
      "type": "misconfiguration",
      "category": "Container Security",
      "severity": "HIGH",
      "original_severity": "HIGH",
      "title": "Privileged container enabled",
      "description": "The container runs with privileged=true, which disables most isolation and gives it access to every device on the node.",
      "evidence": [
        {
          "scanner": "checkov",
          "path": "/lab/broken/privileged.yaml:2-18"
        }
      ],
      "remediation": "Set securityContext.privileged=false.",
      "found_by": [
        "checkov"
      ],
      "confidence": "HIGH",
      "confidence_reason": "single-scanner",
      "blind_shot": false,
      "risk_contribution": 12.6,
      "risk_factors": {
        "base_weight": 7,
        "asset_context": 1.5,
        "exposure": 1,
        "confidence": 1.2,
        "contribution": 12.6
      },
      "attack": [
        {
          "technique": "T1611",
          "name": "Escape to Host",
          "tactic": "Privilege Escalation"
        }
      ],
      "status": "OPEN",
      "first_seen": "",
      "last_seen": "",
      "raw_refs": [
        {
          "scanner": "checkov",
          "rule_id": "CKV_K8S_16"
        }
      ]
    },
    {
      "id": "TK-3d236fda3600",
      "canonical_control": "TATAR-CON-006",
      "resource": "deployment/host-ns-app",
      "namespace": "production",
      "type": "misconfiguration",